{"$schema":"https://json-schema.org/draft/2020-12/schema","$id":"https://schemas.socioprophet.org/delivery-excellence/orggov-scorecard.v0.1.schema.json","title":"OrgGov Scorecard v0.1","type":"object","additionalProperties":false,"required":["schemaVersion","recordType","recordId","workroomRef","workOrderRef","objectiveRef","outcomeRefs","metricPeriod","dimensions","evidenceRefs","recommendations","provenance"],"properties":{"schemaVersion":{"const":"orggov.scorecard.v0.1"},"recordType":{"const":"OrgGovScorecard"},"recordId":{"type":"string"},"workroomRef":{"type":"string"},"workOrderRef":{"type":"string"},"objectiveRef":{"type":"string"},"outcomeRefs":{"type":"array","minItems":1,"items":{"type":"string"}},"metricPeriod":{"type":"object","additionalProperties":false,"required":["start","end"],"properties":{"start":{"type":"string"},"end":{"type":"string"}}},"dimensions":{"type":"object","additionalProperties":false,"required":["evidenceCompleteness","policyCoverage","replayReadiness","operatorLegibility","productCompression","cycleTimeRisk","reviewReadiness","learningClosure"],"properties":{"evidenceCompleteness":{"type":"number"},"policyCoverage":{"type":"number"},"replayReadiness":{"type":"number"},"operatorLegibility":{"type":"number"},"productCompression":{"type":"number"},"cycleTimeRisk":{"type":"number"},"reviewReadiness":{"type":"number"},"learningClosure":{"type":"number"}}},"events":{"type":"array","items":{"type":"object","additionalProperties":false,"required":["eventRef","kind","status"],"properties":{"eventRef":{"type":"string"},"kind":{"type":"string"},"status":{"type":"string"}}}},"evidenceRefs":{"type":"array","minItems":1,"items":{"type":"string"}},"recommendations":{"type":"array","items":{"type":"string"}},"provenance":{"type":"object","additionalProperties":false,"required":["createdBy","createdAt","nonSecret"],"properties":{"createdBy":{"type":"string"},"createdAt":{"type":"string"},"nonSecret":{"type":"boolean"}}},"labels":{"type":"object","additionalProperties":{"type":"string"}}}}
