{"schemaVersion":"orggov.scorecard.v0.1","recordType":"OrgGovScorecard","recordId":"scorecard:orggov-v0:initial","workroomRef":"workroom:orggov-v0","workOrderRef":"workorder:prophet-platform:406","objectiveRef":"objective:orggov-v0","outcomeRefs":["outcome:orggov-captured"],"metricPeriod":{"start":"2026-05-05T13:56:00Z","end":"2026-05-06T17:50:00Z"},"dimensions":{"evidenceCompleteness":0.86,"policyCoverage":0.78,"replayReadiness":0.72,"operatorLegibility":0.83,"productCompression":0.8,"cycleTimeRisk":0.28,"reviewReadiness":0.76,"learningClosure":0.45},"events":[{"eventRef":"github://SocioProphet/prophet-platform/pull/409","kind":"platform-contract","status":"merged"},{"eventRef":"github://SocioProphet/ontogenesis/pull/43","kind":"ontology","status":"merged"},{"eventRef":"github://SocioProphet/prophet-workspace/pull/16","kind":"workspace","status":"merged"},{"eventRef":"github://SocioProphet/agent-registry/pull/23","kind":"authority-registry","status":"merged"},{"eventRef":"github://SocioProphet/policy-fabric/pull/61","kind":"policy-decision","status":"merged"},{"eventRef":"github://SocioProphet/agentplane/pull/128","kind":"execution-evidence","status":"merged"}],"evidenceRefs":["github://SocioProphet/prophet-platform/issues/406","github://SocioProphet/delivery-excellence/issues/14"],"recommendations":["Register OrgGov topology in Sociosphere.","Index OrgGov artifacts in Sherlock Search.","Bind SourceOS state-integrity evidence.","Close learning loop through scorecard deltas."],"provenance":{"createdBy":"delivery-excellence://orggov-scorecard-fixture","createdAt":"2026-05-06T17:50:00Z","nonSecret":true},"labels":{"program":"orggov-v0","parent":"SocioProphet/prophet-platform#406","deliveryIssue":"SocioProphet/delivery-excellence#14"}}
